index,published,extreme,topic,domain,language,valid,title,description,url,image,archive,content,en,de
a0ce81a07d1324764e7a16f16f5cb5cd,2025-11-04T18:58:00Z,Tropical Cyclone,Causes,www.dw.com,en,1,Typhoon Kalmaegi kills scores in central Philippines,"Typhoon Kalmaegi slammed into the Philippines with heavy rains and strong winds, setting off flash floods and forcing residents to their rooftops. Dozens died, including the crew of a military helicopter.",https://www.dw.com/en/typhoon-kalmaegi-kills-scores-in-central-philippines/a-74605322,https://static.dw.com/image/74606864_6.jpg,,"Typhoon Kalmaegi brought torrential rain and strong winds as it hurtled into central Philippines on Tuesday killing more than 40 people, officials said.
The number includes the six crew members of a… [+2172 chars]","Typhoon Kalmaegi kills scores in central Philippines Typhoon Kalmaegi slammed into the Philippines with heavy rains and strong winds, setting off flash floods and forcing residents to their rooftops. Dozens died, including the crew of a military helicopter.","Taifun Kalmaegi tötet Dutzende Menschen im Zentrum der Philippinen Der Taifun Kalmaegi raste mit heftigen Regenfällen und starken Winden über die Philippinen, löste Sturzfluten aus und zwang die Bewohner auf ihre Dächer. Dutzende starben, darunter auch die Besatzung eines Militärhubschraubers."
e53d0aaf0b3b38c5923d4d2a8a7916ff,2025-11-04T19:54:53Z,Tropical Cyclone,Causes,www.abc.net.au,en,1,Typhoon Kalamaegi leaves dozens dead in flooding rain in Philippines,"More than 40 people are dead and hundreds of thousands displaced after rains from Typhoon Kalmaegi flooded the central Philippines, sweeping away trucks and shipping containers.",https://www.abc.net.au/news/2025-11-05/typhoon-kalamaegi-leaves-dozens-dead-in-floods-and-winds/105972498,https://live-production.wcms.abc-cdn.net.au/bc2b75df788db35b59ba50449e4207aa?impolicy=wcms_watermark_news&cropH=900&cropW=1600&xPos=0&yPos=0&width=862&height=485&imformat=generic,,"More than 40 people have died and hundreds of thousands are displaced after rains driven by Typhoon Kalmaegi flooded swathes of the central Philippines.
Entire towns on the island of Cebu were inund… [+4896 chars]","Typhoon Kalamaegi leaves dozens dead in flooding rain in Philippines More than 40 people are dead and hundreds of thousands displaced after rains from Typhoon Kalmaegi flooded the central Philippines, sweeping away trucks and shipping containers.","Taifun Kalamaegi fordert bei überschwemmtem Regen auf den Philippinen Dutzende Tote. Mehr als 40 Menschen sind ums Leben gekommen und Hunderttausende wurden vertrieben, nachdem Regenfälle des Taifuns Kalmaegi die Zentralphilippinen überschwemmt und Lastwagen und Schiffscontainer hinweggefegt haben."
7e02226b17d8411918ff23c507770465,2025-11-05T02:07:20Z,Flood,Hazard,www.digitaljournal.com,en,1,Typhoon death toll climbs to 66 in the Philippines,The death toll from Typhoon Kalmaegi in the Philippines climbed to 66 on Wednesday as residents of hardest-hit Cebu province began picking through homes and businesses devastated by the worst flooding in recent memory. Floodwaters described as unprecedented h…,https://www.digitaljournal.com/world/typhoon-death-toll-climbs-to-66-in-the-philippines/article,https://www.digitaljournal.com/wp-content/uploads/2025/11/eac90e658ca68f3b541c6d7bdc0b047aa9a387fc.jpg,,"Rescuers carry a resident past cars washed away by floods at the height of Typhoon Kalmaegi in the Philippines' Cebu City - Copyright AFP Alan TANGCAWAN
The death toll from Typhoon Kalmaegi in the P… [+3444 chars]",Typhoon death toll climbs to 66 in the Philippines The death toll from Typhoon Kalmaegi in the Philippines climbed to 66 on Wednesday as residents of hardest-hit Cebu province began picking through homes and businesses devastated by the worst flooding in recent memory. Floodwaters described as unprecedented h…,"Zahl der Todesopfer durch den Taifun auf den Philippinen steigt auf 66. Die Zahl der Todesopfer durch den Taifun Kalmaegi auf den Philippinen stieg am Mittwoch auf 66, als Bewohner der am stärksten betroffenen Provinz Cebu damit begannen, Häuser und Geschäfte zu durchsuchen, die von der schlimmsten Überschwemmung der letzten Zeit verwüstet worden waren. Überschwemmungen werden als beispielloses Ausmaß beschrieben …"
